{
  "id": "shift_analysis",
  "route": "/staffing-planner.html#shift_analysis",
  "title": "Shift Analysis",
  "widgets": [],
  "filters": [
    { "name": "store_scope", "effect": "Switches location analysis scope" },
    { "name": "lookback_weeks", "effect": "Changes analysis window" },
    { "name": "compare_mode", "effect": "Switches expected baseline source" }
  ],
  "actions": [
    { "name": "save_context_note", "effect": "Stores note for location-date analysis context" }
  ],
  "permissions": [
    { "role": "manager", "capabilities": ["view", "annotate"] },
    { "role": "owner", "capabilities": ["view", "annotate", "review"] }
  ],
  "sitemap_node_id": "shift-analysis",
  "owner": "ops-analytics"
}
