{
  "id": "dashboard",
  "route": "/index.html",
  "title": "Dashboard",
  "widgets": [
    "hour_by_hour_gross_profit"
  ],
  "filters": [
    { "name": "plan_mode", "effect": "Recomputes KPIs/charts" },
    { "name": "location_focus", "effect": "Scopes metrics and charts" },
    { "name": "date_range", "effect": "Changes period window" },
    { "name": "doordash_mode", "effect": "Switches revenue basis" }
  ],
  "actions": [
    { "name": "export_excel", "effect": "Downloads workbook for selected scope" }
  ],
  "permissions": [
    { "role": "owner", "capabilities": ["view", "export", "configure_assumptions"] },
    { "role": "manager", "capabilities": ["view", "export"] }
  ],
  "sitemap_node_id": "dashboard",
  "owner": "ops-analytics"
}
